{
  "$schema": "https://json-schema.org/draft/2020-12/schema",
  "additionalProperties": false,
  "properties": {
    "exact_Q_authorized": {
      "const": true
    },
    "held_manifest_sha256": {
      "pattern": "^[0-9a-f]{64}$",
      "type": "string"
    },
    "maximum_lane_count": {
      "const": 50
    },
    "normalized_dependencies_sha256": {
      "pattern": "^[0-9a-f]{64}$",
      "type": "string"
    },
    "parallel_authorized": {
      "const": false
    },
    "required_closed_union": {
      "const": [
        0,
        1,
        2,
        3,
        4,
        5,
        6,
        7,
        8,
        9,
        10,
        11,
        12,
        13,
        14,
        15,
        16,
        17,
        18,
        19,
        20,
        21,
        22,
        23,
        24,
        25,
        26,
        27,
        28,
        29,
        30,
        31,
        32,
        33,
        34,
        35,
        36,
        37,
        38,
        39,
        40,
        41,
        42,
        43,
        44,
        45,
        46,
        47,
        48,
        49,
        50,
        51,
        52,
        53,
        54,
        55,
        56,
        57,
        58,
        59,
        60,
        61,
        62,
        63,
        64,
        65,
        66,
        67,
        68,
        69,
        70,
        71,
        72,
        73,
        74,
        75
      ]
    },
    "runner_sha256": {
      "const": "3e5a744b6017dc0ba4a4d9789039bb4697d20fd1b42332195dc015cfd1e91abd"
    },
    "schema": {
      "const": "KRENN_X5_REP4_GROUPS76_125_EXACT_Q_INDEPENDENT_ACCEPTANCE_V1"
    },
    "selected_group_ids": {
      "const": [
        76,
        77,
        78,
        79,
        80,
        81,
        82,
        83,
        84,
        85,
        86,
        87,
        88,
        89,
        90,
        91,
        92,
        93,
        94,
        95,
        96,
        97,
        98,
        99,
        100,
        101,
        102,
        103,
        104,
        105,
        106,
        107,
        108,
        109,
        110,
        111,
        112,
        113,
        114,
        115,
        116,
        117,
        118,
        119,
        120,
        121,
        122,
        123,
        124,
        125
      ]
    },
    "skip_reorder_relaunch_authorized": {
      "const": false
    },
    "source_ledger_sha256": {
      "const": "b311e566fab04932f0c49a285ac3190ae4ac7a02f102799a9a2c6b34a949e4bb"
    },
    "status": {
      "const": "PASS_APPROVE_CONDITIONAL_REP4_GROUPS76_125_ONLY"
    }
  },
  "required": [
    "schema",
    "status",
    "held_manifest_sha256",
    "source_ledger_sha256",
    "normalized_dependencies_sha256",
    "runner_sha256",
    "required_closed_union",
    "selected_group_ids",
    "maximum_lane_count",
    "exact_Q_authorized",
    "parallel_authorized",
    "skip_reorder_relaunch_authorized"
  ],
  "type": "object"
}
